[
 {
  "citation": {
   "locator": "PDF p. 13",
   "source_id": "src-contracts-audit-2026"
  },
  "heading": "Berkeley spent millions of dollars on non-competitive contracts when competition was likely possible.",
  "id": "contracts-audit-2026-finding-1",
  "matter_id": "contracts-audit-2026",
  "number": "1"
 },
 {
  "citation": {
   "locator": "PDF p. 22",
   "source_id": "src-contracts-audit-2026"
  },
  "heading": "Paper contracts, unclear guidance, and short staffing led to delays and overuse of non-competitive contracts.",
  "id": "contracts-audit-2026-finding-2",
  "matter_id": "contracts-audit-2026",
  "number": "2"
 },
 {
  "citation": {
   "locator": "PDF p. 10, Attachment 2",
   "source_id": "src-bcc-2024-12-10-item-24-staff-report"
  },
  "heading": "Without significant additional funding, Berkeley streets will continue to deteriorate and deferred maintenance costs will increase.",
  "id": "rocky-road-audit-2020-finding-1",
  "matter_id": "rocky-road-audit-2020",
  "number": "1"
 },
 {
  "citation": {
   "locator": "PDF p. 11, Attachment 2",
   "source_id": "src-bcc-2024-12-10-item-24-staff-report"
  },
  "heading": "The Streets Rehabilitation and Repair Policy is out-of-date and Public Works is not following it.",
  "id": "rocky-road-audit-2020-finding-2",
  "matter_id": "rocky-road-audit-2020",
  "number": "2"
 }
]
